{
  "schema_version": "task-envelope:v0.1",
  "task_id": "TASK-MERMAID-TOOLBAR-003",
  "role": "implementation_owner",
  "baseline_commit": "1dbfe7f9fa38530ca3225b03bca525b1a99f4ab3",
  "work_package_id": "WP-MERMAID-TOOLBAR-003",
  "allowed_scope": [
    "src/preview/MermaidDiagramToolbar.vue",
    "src/preview/MermaidFullscreenViewer.vue",
    "src/preview/PreviewPane.vue",
    "tests/unit/**",
    "tests/e2e/specs/preview-mermaid.spec.ts",
    "architecture/**",
    "AGENTS.md",
    "readme.md",
    "agent.md"
  ],
  "l0_impact": "modify_existing",
  "l0_rule_ids": [
    "L0-TMK-018",
    "L0-TMK-015A",
    "L0-TMK-008"
  ],
  "must_preserve": [
    "Markdown 源码唯一权威与 Mermaid 预览只读。",
    "Cmd/Ctrl+点击定位与现有回归。",
    "取消导出不产生文件；成功导出原子写入。"
  ],
  "must_reject": [
    "修改 Mermaid 围栏源码或建立第二文档权威。",
    "错误块导出/复制成功路径。"
  ],
  "required_evidence": [
    "unit",
    "integration",
    "runtime_e2e"
  ],
  "stop_conditions": [
    "实际影响超出 allowed_scope。"
  ],
  "notes": "用户确认去掉定位按钮；工具栏顺序 fullscreen/copy/SVG/PNG。"
}
