{
  "schema_version": "task-envelope:v0.1",
  "task_id": "TASK-EXPORT-PDF-001",
  "role": "implementation_owner",
  "baseline_commit": "f121c46112f387b82ee1fc32658afe1ff8280241",
  "work_package_id": "WP-EXPORT-PDF-001",
  "allowed_scope": [
    "src/export/**",
    "src/app/settings/ExportSettingsPanel.vue",
    "src/app/useShellLifecycle.ts",
    "deps/package.json",
    "deps/package-lock.json",
    "tests/unit/**",
    "tests/e2e/specs/**",
    "architecture/**",
    "AGENTS.md",
    "readme.md",
    "agent.md"
  ],
  "l0_impact": "modify_existing",
  "l0_rule_ids": ["L0-TMK-016", "L0-TMK-002", "L0-TMK-014", "L0-TMK-015A"],
  "must_preserve": [
    "Markdown 源码唯一权威与既有 HTML/PNG 导出行为。",
    "取消导出不产生文件；成功单文件原子写入。",
    "PDF 与长图 PNG 共享画布上限与降采样。"
  ],
  "must_reject": [
    "可检索文字 PDF / 分页 PDF / DOCX 首版实现。",
    "从预览 DOM 反推导出权威。",
    "静默写出损坏 PDF。"
  ],
  "required_evidence": ["unit", "integration", "runtime_e2e"],
  "stop_conditions": [
    "实际影响超出 allowed_scope。",
    "需要新增 capability 或原生打印 API。"
  ],
  "notes": "DEC-TMK-20260810-009：长图不分页 PDF；位图嵌入单页；不承诺文字检索。实现 9bc311c；审查修复与 Evidence 绑定 1b6cc4d；WP closeout.decision=closed。超高单页阅读器体验为已定残余风险。"
}
