{
  "schema_version": "task-envelope:v0.1",
  "task_id": "TASK-MERMAID-VIEWER-001",
  "role": "implementation_owner",
  "baseline_commit": "8943da47339bcc9f85ddc7542ce54b55da941ef1",
  "work_package_id": "WP-MERMAID-VIEWER-001",
  "allowed_scope": [
    "src/preview/mermaidDiagramRegistry.ts",
    "src/preview/renderMermaid.ts",
    "src/preview/PreviewPane.vue",
    "src/preview/MermaidDiagramToolbar.vue",
    "src/preview/MermaidFullscreenViewer.vue",
    "src/preview/useMermaidViewport.ts",
    "src/preview/markdownBody.css",
    "src/preview/editing/editablePreview.css",
    "src/export/exportMermaidDiagramPng.ts",
    "src/app/AppShell.vue",
    "src/app/useShellLifecycle.ts",
    "tests/unit/**",
    "tests/e2e/specs/preview-mermaid.spec.ts",
    "tests/e2e/specs/native-export.spec.ts",
    "architecture/**",
    "AGENTS.md",
    "readme.md",
    "agent.md"
  ],
  "l0_impact": "add_new",
  "l0_rule_ids": [
    "L0-TMK-018",
    "L0-TMK-015A",
    "L0-TMK-008",
    "L0-TMK-002",
    "L0-TMK-016"
  ],
  "must_preserve": [
    "Markdown 源码唯一权威与 Mermaid 预览只读。",
    "Cmd/Ctrl+点击定位行为与现有回归。",
    "editable 与 fallback 双路径均可触发工具栏。",
    "取消导出不产生文件；成功导出原子写入。"
  ],
  "must_reject": [
    "修改 Mermaid 围栏源码或建立第二文档权威。",
    "普通点击触发定位或错误块导出成功。",
    "超出画布上限时静默成功。",
    "修改文档级导出三种格式的产品行为。"
  ],
  "required_evidence": [
    "static",
    "unit",
    "integration",
    "runtime_e2e"
  ],
  "stop_conditions": [
    "实际影响超出 allowed_scope。",
    "治理基线尚未进入不可变 commit。",
    "无法在 Tauri WebKit 复现单图 PNG 证据。"
  ],
  "notes": "实现 commit 64c4974b01bd1274db414185cfbf6c276b727fbd；Evidence EV-MERMAID-VIEWER-001-* 已绑定；WP-MERMAID-VIEWER-001 closeout.decision=closed。"
}
